{
  "task_id": "webvoyager_0001",
  "state_id": "webvoyager_0001_step_09",
  "instruction": "Find a blue waterproof hiking jacket under $120 and add it to the cart.",
  "history": [
    {
      "step": 7,
      "action": "click",
      "target": "Men > Casual Jackets",
      "observation": "The page now shows casual jackets and lifestyle outerwear."
    },
    {
      "step": 8,
      "action": "type",
      "target": "search_filter",
      "value": "blue",
      "observation": "Blue casual jackets are shown, but the category is still wrong."
    }
  ],
  "checkpoint_ids": [
    "checkpoint_1_homepage",
    "checkpoint_2_outerwear_category",
    "checkpoint_3_hiking_jackets"
  ],
  "recoverability": "weakly_recoverable",
  "decision": "rollback",
  "rollback_target": "checkpoint_2_outerwear_category",
  "teacher_rationale": "The agent is filtering within the wrong product branch. Rolling back to the outerwear category page preserves useful progress while removing the mistaken category choice.",
  "candidate_scores": {
    "continue": 0.19,
    "branch": 0.41,
    "rollback:checkpoint_2_outerwear_category": 0.84,
    "rollback:checkpoint_3_hiking_jackets": 0.57,
    "restart": 0.13
  }
}
